{
  "schemaVersion": 1,
  "catalogVersion": "2026.08.24.2",
  "generatedAt": "2026-08-24T09:37:38.444Z",
  "sourceId": "deeprunner-official",
  "sourceRevision": "catalog-2026.08.24.2",
  "revocations": [],
  "entries": [
    {
      "id": "@xmanrui/dsh-im",
      "packageName": "@xmanrui/dsh-im",
      "displayName": "DSH IM",
      "summary": "Connect nine IM bots and a public AI Office to your local Harness.",
      "description": "Adds multi-bot IM channel support to DSH behind one settings surface: Feishu/Lark, WeChat, DingTalk, WeCom, QQ, Slack, Telegram, Discord and WhatsApp bots connect by QR code, App Manifest or credentials, each with independent workspace and session bindings. An AI Office Connector lets a public office drive the local Harness through outbound heartbeats and SSE without a public IP. Bot credentials are submitted only to the local Host and stored in the protected credential store.",
      "publisher": "xmanrui",
      "trustLevel": "community",
      "repository": "https://github.com/xmanrui/dsh-im",
      "homepage": "https://github.com/xmanrui/dsh-im#readme",
      "license": "MIT",
      "tags": [
        "im",
        "bot",
        "feishu",
        "wechat",
        "wecom",
        "dingtalk",
        "qq",
        "slack",
        "telegram",
        "discord",
        "whatsapp",
        "notifications"
      ],
      "status": "listed",
      "release": {
        "version": "1.0.2",
        "exactSpec": "@xmanrui/dsh-im@1.0.2",
        "distIntegrity": "sha512-xYZPRjSCHMjXzBinfmJw3OjJRUaPhXN+cLXBUbuTvMHjEocXOTD4SKR/YXKYLVPGTc8zTKBZ1kljbcZ1wLYd4A==",
        "sourceRevision": "9a5a7941af626facd9759a7be499e337c26b47b7",
        "publishedAt": "2026-08-22T09:57:34.976Z",
        "dshVersionRange": "^0.1.0-rc.6",
        "deepRunnerVersionRange": "^0.1.0",
        "platforms": [
          "darwin",
          "win32",
          "linux"
        ],
        "faces": [
          "host",
          "client"
        ],
        "capabilities": [
          "network-access",
          "credential-storage"
        ],
        "releaseNotes": "Initial marketplace release pinning @xmanrui/dsh-im 1.0.2 for DeepRunner's DSH 0.1.0-rc.6 baseline."
      }
    },
    {
      "id": "@zseven-w/dsh-ios",
      "packageName": "@zseven-w/dsh-ios",
      "displayName": "DSH iOS Simulator",
      "summary": "A live, interactive iOS Simulator inside a DeepSeek Harness conversation — plus your real iPhone over USB.",
      "description": "DeepSeek Harness plugin for the iOS Simulator — build, run, and interact with a live simulator stream inside a conversation. Tested with DSH 0.1.1-rc.1.",
      "publisher": "ZSeven-W",
      "trustLevel": "community",
      "repository": "https://github.com/ZSeven-W/dsh-ios.git",
      "homepage": "https://github.com/ZSeven-W/dsh-ios#readme",
      "license": "MIT",
      "tags": [
        "dsh",
        "simulator",
        "ios-simulator",
        "plugin",
        "ios"
      ],
      "status": "listed",
      "release": {
        "version": "0.1.0-rc.5",
        "exactSpec": "@zseven-w/dsh-ios@0.1.0-rc.5",
        "distIntegrity": "sha512-ZAeHkTmm/YpCDc+tGOgj6fAZaGJ6sQkV8q1HaJDV8OLKixtmj+FuNX/DSNOyNduORmwzg5zF/MMuGSq7yijNVw==",
        "sourceRevision": "2e6b9aa4fb608aaebb94acb1c5d44d37c14adfea",
        "publishedAt": "2026-08-23T17:18:35.307Z",
        "dshVersionRange": "^0.1.0-rc.6",
        "deepRunnerVersionRange": "^0.1.0",
        "platforms": [
          "darwin"
        ],
        "faces": [
          "host",
          "client"
        ],
        "capabilities": [
          "filesystem",
          "shell",
          "network-access",
          "device-control"
        ],
        "releaseNotes": "Initial marketplace release pinning @zseven-w/dsh-ios 0.1.0-rc.5."
      }
    }
  ]
}
